id_paper;id_type;Title;Journal;Volume;Number;Pages;Year;ISSN;doi;Abstract;Date;URL;ISBN;Issue;Month
2831;102;Automated cell tracking and analysis in phasecontrast videos iTr;PLoS One;8;;e81266;2013;1932-6203;10.1371/journal.pone.0081266;<p>Cell migration is a key biological process with a role in both physiological and pathological conditions. Locomotion of cells during embryonic development is essential for their correct positioning in the organism; immune cells have to migrate and circulate in response to injury. Failure of cells to migrate or an inappropriate acquisition of migratory capacities can result in severe defects such as altered pigmentation, skull and limb abnormalities during development, and defective wound repair, immunosuppression or tumor dissemination. The ability to accurately analyze and quantify cell migration is important for our understanding of development, homeostasis and disease. In vitro cell tracking experiments, using primary or established cell cultures, are often used to study migration as cells can quickly and easily be genetically or chemically manipulated. Images of the cells are acquired at regular time intervals over several hours using microscopes equipped with CCD camera. The locations (x,y,t) of each cell on the recorded sequence of frames then need to be tracked. Manual computer-assisted tracking is the traditional method for analyzing the migratory behavior of cells. However, this processing is extremely tedious and time-consuming. Most existing tracking algorithms require experience in programming languages that are unfamiliar to most biologists. We therefore developed an automated cell tracking program, written in Java, which uses a mean-shift algorithm and ImageJ as a library. iTrack4U is a user-friendly software. Compared to manual tracking, it saves considerable amount of time to generate and analyze the variables characterizing cell migration, since they are automatically computed with iTrack4U. Another major interest of iTrack4U is the standardization and the lack of inter-experimenter differences. Finally, iTrack4U is adapted for phase contrast and fluorescent cells.</p>;2013;;;11;
2839;103;method for normalizing histology slides for quantitative analysi;Biomedical Imaging: From Nano to Macro, 2009. ISBI '09. IEEE International Symposium on;None;;None;2009;None;10.1109/ISBI.2009.5193250;Inconsistencies in the preparation of histology slides make it difficult to perform quantitative analysis on their results. In this paper we provide two mechanisms for overcoming many of the known inconsistencies in the staining process, thereby bringing slides that were processed or stored under very different conditions into a common, normalized space to enable improved quantitative analysis.;June;;;None;
2850;102;PAR1dependent orientation gradient of dynamic microtubules direc;J Cell Biol;194;;121-35;2011;1540-8140;10.1083/jcb.201103160;<p>Cytoskeletal organization is central to establishing cell polarity in various cellular contexts, including during messenger ribonucleic acid sorting in Drosophila melanogaster oocytes by microtubule (MT)-dependent molecular motors. However, MT organization and dynamics remain controversial in the oocyte. In this paper, we use rapid multichannel live-cell imaging with novel image analysis, tracking, and visualization tools to characterize MT polarity and dynamics while imaging posterior cargo transport. We found that all MTs in the oocyte were highly dynamic and were organized with a biased random polarity that increased toward the posterior. This organization originated through MT nucleation at the oocyte nucleus and cortex, except at the posterior end of the oocyte, where PAR-1 suppressed nucleation. Our findings explain the biased random posterior cargo movements in the oocyte that establish the germline and posterior.</p>;2011 Jul 11;;;1;
2871;102;PALMsiever a tool to turn raw data into results for singlemolecu;Bioinformatics;;;;2014;1367-4811;10.1093/bioinformatics/btu720;<p>During the past decade, localization microscopy (LM) has transformed into an accessible, commercially available technique for life sciences. However, data processing can be challenging to the non-specialist and care is still needed to produce meaningful results. PALMsiever has been developed to provide a user-friendly means of visualizing, filtering and analyzing LM data. It includes drift correction, clustering, intelligent line profiles, many rendering algorithms and 3D data visualization. It incorporates the main analysis and data processing modalities used by experts in the field, as well as several new features we developed, and makes them broadly accessible. It can easily be extended via plugins and is provided as free of charge open-source software.</p><p><b>CONTACT: </b>thomas.pengo@gmail.com.</p>;2014 Oct 31;;;;
2882;102;Arabidopsis plants acclimate to water deficit at low cost throug;Plant Physiology;154;;357–372;2010;1532-2548;10.1104/pp.110.157008;Growth and carbon (C) fluxes are severely altered in plants exposed to soil water deficit. Correspondingly, it has been suggested that plants under water deficit suffer from C shortage. In this study, we test this hypothesis in Arabidopsis (Arabidopsis thaliana) by providing an overview of the responses of growth, C balance, metabolites, enzymes of the central metabolism, and a set of sugar-responsive genes to a sustained soil water deficit. The results show that under drought, rosette relative expansion rate is decreased more than photosynthesis, leading to a more positive C balance, while root growth is promoted. Several soluble metabolites accumulate in response to soil water deficit, with K(+) and organic acids as the main contributors to osmotic adjustment. Osmotic adjustment costs only a small percentage of the daily photosynthetic C fixation. All C metabolites measured (not only starch and sugars but also organic acids and amino acids) show a diurnal turnover that often increased under water deficit, suggesting that these metabolites are readily available for being metabolized in situ or exported to roots. On the basis of 30 enzyme activities, no in-depth reprogramming of C metabolism was observed. Water deficit induces a shift of the expression level of a set of sugar-responsive genes that is indicative of increased, rather than decreased, C availability. These results converge to show that the differential impact of soil water deficit on photosynthesis and rosette expansion results in an increased availability of C for the roots, an increased turnover of C metabolites, and a low-cost C-based osmotic adjustment, and these responses are performed without major reformatting of the primary metabolism machinery.;;http://www.ncbi.nlm.nih.gov/pubmed/20631317;;;
2886;102;Towards realtime image deconvolution application to confocal and;Sci Rep;3;;2523;2013;2045-2322;10.1038/srep02523;<p>Although deconvolution can improve the quality of any type of microscope, the high computational time required has so far limited its massive spreading. Here we demonstrate the ability of the scaled-gradient-projection (SGP) method to provide accelerated versions of the most used algorithms in microscopy. To achieve further increases in efficiency, we also consider implementations on graphic processing units (GPUs). We test the proposed algorithms both on synthetic and real data of confocal and STED microscopy. Combining the SGP method with the GPU implementation we achieve a speed-up factor from about a factor 25 to 690 (with respect the conventional algorithm). The excellent results obtained on STED microscopy images demonstrate the synergy between super-resolution techniques and image-deconvolution. Further, the real-time processing allows conserving one of the most important property of STED microscopy, i.e the ability to provide fast sub-diffraction resolution recordings.</p>;2013;;;;
2897;102;Segmentation and quantification of subcellular structures in flu;Nat Protoc;9;;586-96;2014;1750-2799;10.1038/nprot.2014.037;<p>Detection and quantification of fluorescently labeled molecules in subcellular compartments is a key step in the analysis of many cell biological processes. Pixel-wise colocalization analyses, however, are not always suitable, because they do not provide object-specific information, and they are vulnerable to noise and background fluorescence. Here we present a versatile protocol for a method named 'Squassh' (segmentation and quantification of subcellular shapes), which is used for detecting, delineating and quantifying subcellular structures in fluorescence microscopy images. The workflow is implemented in freely available, user-friendly software. It works on both 2D and 3D images, accounts for the microscope optics and for uneven image background, computes cell masks and provides subpixel accuracy. The Squassh software enables both colocalization and shape analyses. The protocol can be applied in batch, on desktop computers or computer clusters, and it usually requires <1 min and <5 min for 2D and 3D images, respectively. Basic computer-user skills and some experience with fluorescence microscopy are recommended to successfully use the protocol.</p>;2014 Mar;;;3;
2901;102;Automated detection and measurement of isolated retinal arteriol;PLoS One;9;;e91791;2014;1932-6203;10.1371/journal.pone.0091791;<p>Pressure myography studies have played a crucial role in our understanding of vascular physiology and pathophysiology. Such studies depend upon the reliable measurement of changes in the diameter of isolated vessel segments over time. Although several software packages are available to carry out such measurements on small arteries and veins, no such software exists to study smaller vessels (<50 µm in diameter). We provide here a new, freely available open-source algorithm, MyoTracker, to measure and track changes in the diameter of small isolated retinal arterioles. The program has been developed as an ImageJ plug-in and uses a combination of cost analysis and edge enhancement to detect the vessel walls. In tests performed on a dataset of 102 images, automatic measurements were found to be comparable to those of manual ones. The program was also able to track both fast and slow constrictions and dilations during intraluminal pressure changes and following application of several drugs. Variability in automated measurements during analysis of videos and processing times were also investigated and are reported. MyoTracker is a new software to assist during pressure myography experiments on small isolated retinal arterioles. It provides fast and accurate measurements with low levels of noise and works with both individual images and videos. Although the program was developed to work with small arterioles, it is also capable of tracking the walls of other types of microvessels, including venules and capillaries. It also works well with larger arteries, and therefore may provide an alternative to other packages developed for larger vessels when its features are considered advantageous.</p>;2014;;;3;
2906;102;FISHquant automatic counting of transcripts in 3D FISH images;Nat Methods;10;;277-8;2013;1548-7105;10.1038/nmeth.2406;;2013 Apr;;;4;
2915;102;rapidSTORM accurate fast opensource software for localization mi;Nat Methods;9;;1040-1;2012;1548-7105;10.1038/nmeth.2224;;2012 Nov;;;11;
2918;102;PixFRET an ImageJ plugin for FRET calculation that can accommoda;Microsc Res Tech;68;;51-8;2005;1059-910X;10.1002/jemt.20215;<p>Fluorescence resonance energy transfer (FRET) allows the user to investigate interactions between fluorescent partners. One crucial issue when calculating sensitized emission FRET is the correction for spectral bleed-throughs (SBTs), which requires to calculate the ratios between the intensities in the FRET and in the donor or acceptor settings, when only the donor or acceptor are present. Theoretically, SBT ratios should be constant. However, experimentally, these ratios can vary as a function of fluorophore intensity, and assuming constant values may hinder precise FRET calculation. One possible cause for such a variation is the use of a microscope set-up with different photomultipliers for the donor and FRET channels, a set-up allowing higher speed acquisitions on very dynamic fluorescent molecules in living cells. Herein, we show that the bias introduced by the differential response of the two PMTs can be circumvented by a simple modeling of the SBT ratios as a function of fluorophore intensity. Another important issue when performing FRET is the localization of FRET within the cell or a population of cells. We hence developed a freely available ImageJ plug-in, called PixFRET, that allows a simple and rapid determination of SBT parameters and the display of normalized FRET images. The usefulness of this modeling and of the plug-in are exemplified by the study of FRET in a system where two interacting nuclear receptors labeled with ECFP and EYFP are coexpressed in living cells.</p>;2005 Sep;;;1;
2933;102;TANGO a generic tool for highthroughput 3D image analysis for st;Bioinformatics;29;;1840-1;2013;1367-4811;10.1093/bioinformatics/btt276;<p><b>MOTIVATION: </b>The cell nucleus is a highly organized cellular organelle that contains the genetic material. The study of nuclear architecture has become an important field of cellular biology. Extracting quantitative data from 3D fluorescence imaging helps understand the functions of different nuclear compartments. However, such approaches are limited by the requirement for processing and analyzing large sets of images.</p><p><b>RESULTS: </b>Here, we describe Tools for Analysis of Nuclear Genome Organization (TANGO), an image analysis tool dedicated to the study of nuclear architecture. TANGO is a coherent framework allowing biologists to perform the complete analysis process of 3D fluorescence images by combining two environments: ImageJ (http://imagej.nih.gov/ij/) for image processing and quantitative analysis and R (http://cran.r-project.org) for statistical processing of measurement results. It includes an intuitive user interface providing the means to precisely build a segmentation procedure and set-up analyses, without possessing programming skills. TANGO is a versatile tool able to process large sets of images, allowing quantitative study of nuclear organization.</p><p><b>AVAILABILITY: </b>TANGO is composed of two programs: (i) an ImageJ plug-in and (ii) a package (rtango) for R. They are both free and open source, available (http://biophysique.mnhn.fr/tango) for Linux, Microsoft Windows and Macintosh OSX. Distribution is under the GPL v.2 licence.</p><p><b>CONTACT: </b>thomas.boudier@snv.jussieu.fr</p><p><b>SUPPLEMENTARY INFORMATION: </b>Supplementary data are available at Bioinformatics online.</p>;2013 Jul 15;;;14;
2956;102;Automated whole animal bioimaging assay for human cancer dissemi;PLoS One;7;;e31281;2012;1932-6203;10.1371/journal.pone.0031281;<p>A quantitative bio-imaging platform is developed for analysis of human cancer dissemination in a short-term vertebrate xenotransplantation assay. Six days after implantation of cancer cells in zebrafish embryos, automated imaging in 96 well plates coupled to image analysis algorithms quantifies spreading throughout the host. Findings in this model correlate with behavior in long-term rodent xenograft models for panels of poorly- versus highly malignant cell lines derived from breast, colorectal, and prostate cancer. In addition, cancer cells with scattered mesenchymal characteristics show higher dissemination capacity than cell types with epithelial appearance. Moreover, RNA interference establishes the metastasis-suppressor role for E-cadherin in this model. This automated quantitative whole animal bio-imaging assay can serve as a first-line in vivo screening step in the anti-cancer drug target discovery pipeline.</p>;2012;;;2;
2960;102;Objective comparison of particle tracking methods;Nat Methods;11;;281-9;2014;1548-7105;10.1038/nmeth.2808;<p>Particle tracking is of key importance for quantitative analysis of intracellular dynamic processes from time-lapse microscopy image data. Because manually detecting and following large numbers of individual particles is not feasible, automated computational methods have been developed for these tasks by many groups. Aiming to perform an objective comparison of methods, we gathered the community and organized an open competition in which participating teams applied their own methods independently to a commonly defined data set including diverse scenarios. Performance was assessed using commonly defined measures. Although no single method performed best across all scenarios, the results revealed clear differences between the various approaches, leading to notable practical conclusions for users and developers.</p>;2014 Mar;;;3;
2962;102;Fluorophore localization algorithms for superresolution microsco;Nat Methods;11;;267-79;2014;1548-7105;10.1038/nmeth.2844;<p>Super-resolution localization microscopy methods provide powerful new capabilities for probing biology at the nanometer scale via fluorescence. These methods rely on two key innovations: switchable fluorophores (which blink on and off and can be sequentially imaged) and powerful localization algorithms (which estimate the positions of the fluorophores in the images). These techniques have spurred a flurry of innovation in algorithm development over the last several years. In this Review, we survey the fundamental issues for single-fluorophore fitting routines, localization algorithms based on principles other than fitting, three-dimensional imaging, dipole imaging and techniques for estimating fluorophore positions from images of multiple activated fluorophores. We offer practical advice for users and adopters of algorithms, and we identify areas for further development.</p>;2014 Mar;;;3;
2964;102;Software opens the door to quantitative imaging;Nat Methods;4;;120-1;2007;1548-7091;10.1038/nmeth0207-120;;2007 Feb;;;2;
2973;102;Fluorescence Lifetime Imaging Microscopy FLIM Data Analysis with;Journal of Statistical Software;18;;1–20;2007;1548-7660;;Fluorescence Lifetime Imaging Microscopy (FLIM) allows fluorescence lifetime images of biological objects to be collected at 250 nm spatial resolution and at (sub-)nanosecond temporal resolution. Often ncomp kinetic processes underlie the observed fluorescence at all locations, but the intensity of the fluorescence associated with each process varies per-location, i.e., per-pixel imaged. Then the statistical challenge is global analysis of the image: use of the fluorescence decay in time at all locations to estimate the ncomp lifetimes associated with the kinetic processes, as well as the amplitude of each kinetic process at each location. Given that typical FLIM images represent on the order of 102 timepoints and 103 locations, meeting this challenge is computationally intensive. Here the utility of the TIMP package for R to solve parameter estimation problems arising in FLIM image analysis is demonstrated. Case studies on simulated and real data evidence the applicability of the partitioned variable projection algorithm implemented in TIMP to the problem domain, and showcase options included in the package for the visual validation of models for FLIM data.;1;http://www.jstatsoft.org/v18/i08/paper;;;
2983;102;Microtubule dynamics reconstituted in vitro and imaged by single;Methods Cell Biol;95;;221-45;2010;0091-679X;10.1016/S0091-679X(10)95013-9;<p>In vitro assays that reconstitute the dynamic behavior of microtubules provide insight into the roles of microtubule-associated proteins (MAPs) in regulating the growth, shrinkage, and catastrophe of microtubules. The use of total internal reflection fluorescence microscopy with fluorescently labeled tubulin and MAPs has allowed us to study microtubule dynamics at the resolution of single molecules. In this chapter we present a practical overview of how these assays are performed in our laboratory: fluorescent labeling methods, strategies to prolong the time to photo-bleaching, preparation of stabilized microtubules, flow-cells, microtubule immobilization, and finally an overview of the workflow that we follow when performing the experiments. At all stages, we focus on practical tips and highlight potential stumbling blocks.</p>;2010;;;;
3000;102;Distinctive Image Features from ScaleInvariant Keypoints;International Journal of Computer Vision;60;;91-110;2004;0920-5691;10.1023/B:VISI.0000029664.99615.94;;;http://dx.doi.org/10.1023/B%3AVISI.0000029664.99615.94;;;
3001;103;Multiimage matching using multiscale oriented patches;Proceedings of the IEEE Computer Society Conference on Computer Vision and Pattern Recognition;None;;None;2005;None;;This paper describes a novel multi-view matching framework based on a new type of invariant feature. Our features are located at Harris corners in discrete scale-space and oriented using a blurred local gradient. This defines a rotationally invariant frame in which we sample a feature descriptor, which consists of an 8 &amp;times; 8 patch of bias/gain normalised intensity values. The density of features in the image is controlled using a novel adaptive non-maximal suppression algorithm, which gives a better spatial distribution of features than previous approaches. Matching is achieved using a fast nearest neighbour algorithm that indexes features based on their low frequency Haar wavelet coefficients. We also introduce a novel outlier rejection procedure that verifies a pairwise feature match based on a background distribution of incorrect feature matches. Feature matches are refined using RANSAC and used in an automatic 2D panorama stitcher that has been extensively tested on hundreds of sample inputs.;;;;None;
3023;102;Sickle cell anaemia among EtiTurks haematological clinical and g;Br J Haematol;64;;45-55;1986;0007-1048;;<p>Haematological and genetic observations have been made on 71 SS Eti-Turk patients and their relatives from Cukurova (southern Turkey) and of immigrant families in The Netherlands. Similar data were collected for 25 Black patients and their relatives from Surinam, Netherlands Antilles, and Kenya. Haematological and clinical results were the same for both groups; the haemolytic anaemia in the Turkish patients was as severe as in the others. Haplotyping, involving nine restriction sites, identified haplotype 19 (Antonarakis et al, 1984) as the major type among the Eti-Turks; this chromosome has previously primarily been observed among SS patients from West Africa. The suggestion that the beta S-chromosome among Eti-Turks originates from that area is supported by a relatively high incidence of alpha-thalassaemia-2 (the 3.7 kb deletion), also frequently present in the Black population of West Africa, and by the absence of other major haplotypes, such as types 20 and 3, characteristic for the beta S-chromosome in the population of Central Africa and Kenya, and in Senegal, respectively. The Saudi Arabian type of beta S chromosome in association with the haplotype 19 beta S chromosome was present in only one Eti-Turk patient; this 30-year-old female was mildly affected and exhibited a high level of fetal haemoglobin.</p>;1986 Sep;;;1;
3026;102;Active mask segmentation of fluorescence microscope images;IEEE Trans Image Process;18;;1817-29;2009;1057-7149;10.1109/TIP.2009.2021081;<p>We propose a new active mask algorithm for the segmentation of fluorescence microscope images of punctate patterns. It combines the (a) flexibility offered by active-contour methods, (b) speed offered by multiresolution methods, (c) smoothing offered by multiscale methods, and (d) statistical modeling offered by region-growing methods into a fast and accurate segmentation tool. The framework moves from the idea of the "contour" to that of "inside and outside," or masks, allowing for easy multidimensional segmentation. It adapts to the topology of the image through the use of multiple masks. The algorithm is almost invariant under initialization, allowing for random initialization, and uses a few easily tunable parameters. Experiments show that the active mask algorithm matches the ground truth well and outperforms the algorithm widely used in fluorescence microscopy, seeded watershed, both qualitatively, as well as quantitatively.</p>;2009 Aug;;;8;
3028;103;SLTLoG A Vesicle Segmentation Method with Automatic Scale Select;{ISBI - 2014 IEEE International Symposium on Biomedical Imaging};None;;None;2014;None;;;;https://hal.inria.fr/hal-00921793;;None;
3031;102;Stepbystep quantitative analysis of focal adhesions;MethodsX;1;;56–59;2014;22150161;10.1016/j.mex.2014.06.004;;;http://www.researchgate.net/publication/263737052\_Step-by-step\_quantitative\_analysis\_of\_focal\_adhesions;;;
